{
  "event_id": "evt_0001",
  "match_id": "match_2026_0905_01",
  "team_id": "team_a",
  "player_id": "player_10",
  "type": "pass",
  "subtype": "through_ball",
  "timestamp": 125.4,
  "period": 1,
  "location": { "x": 45.2, "y": 30.1 },
  "end_location": { "x": 68.7, "y": 42.3 },
  "outcome": "complete",
  "related_event_id": null,
  "metadata": {
    "recipient_player_id": "player_9",
    "pass_length": "long",
    "under_pressure": false
  }
}
